<?xml version="1.0" encoding="UTF-8"?>
<jlc xmlns="http://www.jlcindia.com/jlc"
 xmlns:xsi="http//www.w3.org/2001/XMLSchema-instance"
 schemaLocation="http://www.jlcindia.com/jlc jlc.xsd">
 
 <student sid="11">
 <sname>sri</sname>
 <email>sri@gmail</email>
 <phone>12345</phone>
 <fee>999.99</fee>
 </student>
 <course cid="c-99">
 <cname>JAVA</cname>
 <cost>2000</cost>
 </course>
 </jlc>